회사,날짜,시간,카테고리,제목,본문
휴스틸,2018.03.09,1125,전체,"""美 수출길 원천봉쇄되나"" 관세폭탄에 철강업계 비상","도널드 트럼프 미국 대통령의 최종 결정으로 수입산 철강에 대한 고율의 관세 부과안이 현실화되자 국내 철강업계의 우려가 커지고 있다. 일부 철강제품의 경우 사실상 미국 수출길이 막히면서 타격이 불가피해졌다.9일 철강업계에 따르면 트럼프 대통령은 8일(현지 시각) 무역확장법 제232조에 근거해 수입 철강과 알루미늄 제품에 각각 25%, 10%의 관세 부과에 서명했다. 이달 23일부터 관세가 부과되며 부과 기간은 명시되지 않았다. 트럼프 대통령은 “상당히 오랜 기간(for a long time) 지속할 것”이라고 밝혔다. 다만 캐나다와 멕시코 등 북미자유무역협정(NAFTA·나프타) 재협상 상대국은 관세 조치 대상국에서 제외됐다. 한국무역협회에 따르면 한국의 미국 철강 수출액 중 73.6%가 이번 조치의 영향을 받을 것으로 보인다. 이같은 피해 규모는 전 세계에서 브라질(78.5%) 다음으로 큰 것이다. 무역확장법 제232조 적용 대상이 되는 철강 제품은 △판재류 △원형강류 △파이프·튜브 △반제품 △스테인레스 등 5가지다. 지난해 이 제품들의 전 세계 수출 금액은 244억4100만달러로 이 중 미국으로 수출하는 비중은 12.2%(29억8000만달러)였다. /사진제공=한국무역협회지난해 한국의 대미 수출 비중이 가장 높은 제품은 파이프·튜브(60.5%·16억3400만 달러)였다. 그 뒤를 원형강류(9.1%·2억2300만 달러), 스테인레스(6.3%·2억1600만 달러), 판재류(5.8%·9억100만 달러), 반제품(0.7%·300만 달러) 등이 이었다. 제현정 무역협회 통상지원단 차장은 “그간 미국으로부터 반덤핑 상계관세를 받고 있는 제품 중 98.2%(23억4000만 달러)가 이번에 232조 대상 품목에 포함됐다”면서 “현재 부과되고 있는 관세에 추가 세금이 중복으로 붙으면서 한국 기업의 부담이 커질 수 밖에 없다”고 지적했다.다만 포스코나 현대제철과 같은 대기업의 피해는 생각보다 크지 않을 전망이다. 업계 추산 포스코 (236,500원 2000 -0.8%)(냉간압연·열연강판) 대미 수출 규모는 전체 판매량의 0.5%인 15만톤 수준이다. 현대제철 (31,450원 50 -0.2%)(냉간압연강판)도 전체의 4.7%(102만톤)에 불과하다. 수출 규모가 크지 않지만 기존 30~60%대의 관세에 추가 관세가 더해져 미국 수출길은 사실상 막힌 셈이다.직접적 피해는 중견 강관업계에 집중될 것으로 보인다. 세아제강 (47,400원 0 0.0%)과 휴스틸 (9,980원 20 -0.2%), 넥스틸 등 주요 강관 3사의 경우 매출 손실이 불가피해졌다. 지난해 매출액 대비 대미 수출 비중은 넥스틸이 80%로 가장 크며 휴스틸 52%, 세아제강 20% 수준이다. 미국 상무부는 현재 유정용 강관에 대해 6.66∼46.37%를 반덤핑 관계를 부과하고 있어 이번 관세부과 조치로 한국 철강업체들은 미국 수출 시 제품별로 최대 71%의 관세를 부담하게 됐다. 지난해 국내 철강업계의 미국 전체 수출물량 355만톤 가운데 56%인 199만톤이 강관이었다. 철강협회에 따르면 2015년 110만톤 수준이었던 미국 강관 수출은 지난해 199만톤으로 80.9% 늘었다. 철강업계 관계자는 “유정용 강관의 경우 미국 업체와 15~20% 정도 가격 차이가 나는데 25% 관세가 더해지면 한국 업체의 가격경쟁력은 밀리게 되는 것”이라면서 “미국 비중이 절대적인 중소 철강업체들은 국내에서 생산해 수출하는 것만으로는 사업이 불가능하다”고 설명했다. 실제로 세아제강은 2016년 미국 현지 생산법인을 인수해 인력과 설비를 보강했으며 넥스틸은 이미 미국 휴스턴에 공장 설립을 추진하고 있다.경제단체들도 일제히 우려의 목소리를 냈다. 배상근 전국경제인연합 상무는 “이번 미국의 철강 수입제재는 세계적인 보호무역주의 확산을 초래해 세계 경제의 위축이 우려된다”며 “미국발 보호무역주의의 확산을 경계하는 한편 우리 기업들의 통상애로 해소에 만전을 기하겠다”고 말했다.이경상 대한상공회의소 경제조사본부장도 “세계 각국 간 관세전쟁이 본격화 국면으로 진입하는 것은 아닌지 우려된다”면서 “관세전쟁에 대비하기 위해 우호세력 확보와 함께 EU(유럽연합) 등과 연대해 철회압박을 가하는 투트랙(Two-Track) 전략이 필요할 것”이라고 덧붙였                            "
휴스틸,2018.03.06,1743,경제,"`철강 장벽` 높이는 美…국내업계 ""미국수출 꽉 막겠다는건가""","◆ 몰아치는 美통상압박 ◆ 미국은 5일(현지시간) 한국산 철강 제품이 미국 산업에 피해를 줬다는 조사 결과를 발표하며 통상 압박의 고삐를 더욱 강하게 죄었다. 이날 미국 국제무역위원회(ITC)는 ""한국, 캐나다, 중국, 그리스, 인도, 터키에서 수입한 대구경 강관이 미국 산업에 실질적 피해를 입혔다""며 ""이들 제품에 대한 조사를 계속하기로 의견을 모았다""고 밝혔다.ITC가 이 같은 판단을 내린 데 따라 미국 상무부는 다음달 16일까지 조사하고 6월 29일까지 반덤핑·상계관세 부과 여부를 최종 결정한다. 대구경 강관은 직경이 406.4㎜ 이상인 제품으로, 건설·토목 공사와 송유관 제작 등에 주로 사용된다.국내 철강업체의 대구경 강관 미국 수출 규모는 작년 기준 1억5000만달러로 금액은 크지 않은 편이다. 그러나 업계에서는 미국에 수출하는 한국산 철강 제품의 88%가 이미 반덤핑·상계관세를 적용받는 상황에서 그동안 수입규제를 피해 있던 대구경 강관마저 규제 대상에 포함되자 충격에 휩싸였다. ITC의 대형 구경 강관에 대한 관세 부과 방침에 철강업계는 망연자실한 분위기다. 대형 구경 강관 자체 수출량은 얼마 안 되는데 이마저도 관세를 통한 무역장벽을 높이려는 미국 측 조치에 대해 한 철강업계 관계자는 ""대미 수출을 완전히 틀어막겠다는 것""이라고 말했다. 6일 철강협회에 따르면 한국의 대미 대형 구경 강관 수출액은 2015년 1억5075만달러, 2016년 1억1095만달러, 작년 1억5284만달러(약 1644억원) 수준이다. 전체 대미 수출 금액에서 차지하는 비중은 각각 4.8%, 4.1%, 4.7% 수준에 불과하다.이번 조치로 세아제강과 현대제철, 중견 철강업체인 휴스틸 등 주요 수출 기업이 입는 피해는 유정용 강관에 비하면 크지 않을 전망이다. 각 업체의 대형 구경 강관 수출량이 전체 대미 수출에서 차지하는 비중도 현대제철 0.03%, 세아제강 5%, 휴스틸 6%로 전혀 높은 수준은 아니다.문제는 이 같은 미국 측 움직임이 우리 철강 제품에 대한 미국 측 입장을 여실히 보여준다는 점이다. 미국은 최근 몇 년간 세계무역기구(WTO)와 한미 자유무역협정(FTA)에 따라 정부 보조금 또는 지원(상계관세)을 받거나 과도하게 낮은 가격으로 수출하는 제품(반덤핑)에 대해 고율의 보복관세를 부과해왔다. 포스코는 현재 60% 수준 관세를 부과받아 건축 제품이나 파이프용으로 판매되는 열연강판의 대미 수출이 사실상 막힌 상황이다.이런 보복관세에도 불구하고 한국 철강업체들은 비교적 잘 대응해왔다. 실제로 작년 대미 철강 수출량은 354만2527t, 수출 금액은 32억6000만달러로 집계된다. 수출량이 전년 대비 5.3% 줄었지만 수출 금액은 21.4% 증가했다. 단위당 가격이 올랐기 때문이다.철강업계 관계자는 ""이미 미국은 한국산 철강제품 88%에 관세를 부과하고 있는데 그동안 관세 무풍지대였던 대형 구경 강관까지 대상에 포함시키는 것은 한국산을 아예 미국 시장에서 퇴출시키려는 의도로 보인다""고 말했다.이르면 이번주 혹은 다음주에 도널드 트럼프 미국 대통령이 결정할 모든 국가의 철강 제품에 대한 일률적 관세 부과 역시 피할 수 없게 됐다. 이달 초 미국이 모든 철강 제품에 25% 관세를 일률적으로 부과한다는 발표가 나왔지만 철강업계에서는 희망의 끈을 놓지 않고 있었다. 중국은 물론이고 유럽연합(EU), 캐나다 등 다른 동맹국들도 강도 높게 비판하면서 무역전쟁 발발 우려로 미국이 발표 직전 규제 수준을 낮추지 않을까 하는 기대가 내심 있었기 때문이다.하지만 미국의 이번 조치는 11월 중간선거까지 지속적으로 보호무역 기조를 이어간다는 의지를 사실상 천명한 셈이어서 철강업계의 시름은 깊어질 전망이다.특히 미국의 보호무역 기조에 맞춰 다른 나라들도 무역장벽을 높여가는 분위기라 업체들의 고민은 커지고 있다. 한국무역협회 수입규제 통합지원센터에 따르면 국내 철강업체들은 이날 기준 18개 나라에서 총 85건의 수입 규제(조사 중인 건 포함)를 받고 있다. 수입 규제에는 반덤핑, 세이프가드 등이 포함돼 있다. 국가별로 보면 미국이 총 26건으로 1위를 기록하고 있다. 미국은 이번에 미국 산업에 실질적인 피해를 주고 있다고 판단한 대형 구경 강관 외에도 한국산 냉간압연강관과 탄소합금강선재에 대해 반덤핑 조사를 하고 있다. 이어 태국(9건) 캐나다(7건) 인도(7건) 말레이시아(6건) 호주(6건) 등이 뒤를 이었다.[워싱턴 = 이진명 특파원 / 고재만 기자 / 우제윤 기자][ⓒ 매일경제 & mk.co.kr, 무단전재 및 재배포 금지]        					"
휴스틸,2018.03.03,0502,전체,금리인상 우려 속 무역분쟁 악재… 글로벌 증시 요동,"韓 ‘12개국 53% 부과’ 피해 코스피 2400선 겨우 지켜日 닛케이는 2.5% 떨어져… 中·홍콩 증시도 일제히 하락파월 연준 의장 행보 불확실… 시장 변동성 이어질 가능성 커미국 도널드 트럼프 대통령이 던진 ‘관세 폭탄’에 글로벌 증시가 직격탄을 맞았다. 뉴욕 증시 급락에 이어 2일 아시아 증시가 줄줄이 내렸다. 글로벌 금융시장은 미국 연방준비제도(Fed·연준)의 기준금리 인상 우려와 함께 미국의 보호무역주의 정책 강화라는 이중고를 안게 됐다. 이날 코스피지수는 트럼프발(發) 관세전쟁 우려에 오전 중 가파르게 하락했다. 장중 한때 2390선이 무너졌다. 다만 한국 등 12개국에만 53%를 부과하는 최악의 방식은 피했다는 분석에 저가 매수세가 유입됐다. 전날보다 1.04% 내린 2402.16으로 마감하며 가까스로 2400선은 지켜냈다. 외국인과 기관이 각각 2329억원과 3072억원을 순매도하며 지수 하락을 주도했다. 미국의 수입 철강 25% 관세 부과에 직간접 영향을 받는 포스코(3.6%) 휴스틸(2.54%) 세아제강(1.84%) 등이 내렸다. 오히려 당초 12개국에서 빠졌다가 규제에 포함된 일본의 증시 타격이 컸다. 일본 닛케이평균주가는 2.5% 하락했다. 중국, 홍콩 증시도 하락했다. 독일 등 유럽 증시도 일제히 하락세로 출발했다. 글로벌 증시는 미국 기준금리 인상이 가속화될 우려 때문에 좀처럼 기를 펴지 못하고 있는 상황이었다. 여기에 무역분쟁 악재까지 겹치며 당분간 증시의 조정 국면은 이어질 것으로 전망된다. 우선 제롬 파월 미 연준 의장의 행보가 여전히 불확실성으로 남아 있다는 게 부담이다. 파월 의장은 전날 미 상원에 출석해 “아직 임금이 오르고 있다는 결정적 증거가 없다”고 말했다. 지난달 27일 미 하원에서의 매파적(금리 인상 선호) 발언보다는 다소 누그러진 것으로 해석됐다. 하지만 파월 의장이 이제 막 공식적인 데뷔 무대를 치른 점을 고려할 때 오는 20∼21일 연방공개시장위원회(FOMC) 회의 전까지는 시장 변동성이 이어질 가능성이 높다. 트럼프정부의 보호무역주의는 더 예측하기 어려운 변수다. 특히 장기간에 걸쳐 돌발 이슈가 터져 나올 수 있다. 하나금융투자 김두언 선임연구원은 “오는 11월 미국 중간선거 때까지 정치 이슈와 얽힐 수밖에 없는 사안”이라며 “끝이 아니고 시작이라는 점에서 부담스러운 부분”이라고 말했다. 미 다우존스산업평균지수는 1일(현지시간) 트럼프 대통령 발언 충격에 1.68% 급락했다. 일부 철강주가 올랐지만, 자동차 등 제조업체들이 원가 상승에 시달릴 수 있다는 점이 악재로 부각됐다. 글로벌 주요국들이 보복 관세를 매길 수 있다는 점도 미 증시의 부담 요소다. 보호무역 이슈는 한국 증시에도 악재로 분석된다. 다만 이달 FOMC 회의를 통해 미국의 금리인상 방향성이 결정되면 저가 매수세가 유입될 수 있다는 기대감도 나온다. 키움증권 서상영 연구원은 “지난달 수출이 설 연휴 기간에도 불구하고 지난해에 비해 증가하는 등 지표가 양호하다”고 말했다. 보호무역 이슈가 이미 한국 증시에 반영돼 있고, 지난해 전체 국내 수출액(5737억 달러) 중 미국에 수출하는 철강재 비율은 0.5%로 비중이 높지 않다는 분석도 있다.나성원 기자 naa@kmib.co.kr그래픽=이석희 기자"
휴스틸,2018.03.03,0500,전체,‘트럼프 관세폭탄’ 중소 철강업체에 직격탄… “매출 손실 1조”,"반덤핑·상계관세 부과 상태서 추가로 부과… 수출에 악영향정부, WTO 제소 카드 쓸지 주목도널드 트럼프 미국 대통령의 수입산 철강 관세 부과 방침 소식이 전해지자 2일 우리 정부는 긴급회의를 열고 대책을 논의했다. 정부와 철강업계는 50%가 넘는 관세를 내야 하는 최악의 경우를 피했다는 데 안도하면서도 대미 철강 수출에 입을 타격이 적지 않을 것으로 내다보고 있다. 중견 철강업체를 중심으로 매출 손실이 1조원에 육박할 것이라는 예상이 나온다. 산업통상자원부와 철강업계에 따르면 트럼프가 언급한 모든 철강 수입품에 대한 25% 관세는 애초 거론된 한국·중국 등 12개국의 철강 제품에 53% 관세를 부과하는 안보다 관세율이 낮다. 하지만 미국으로 수출하는 대부분 철강재에 이미 관세가 붙는 상황이어서 추가 관세는 대미 수출비중이 높은 중견 철강업체에 직격탄이 될 가능성이 크다. 산업부는 이날 백운규 장관 주재로 내부 회의를 열고 대책을 논의했다. 정부는 미국의 최종결정 전까지 현지 정책담당자와 이해당사자를 접촉하고 설득하는 ‘아웃리치’ 활동을 적극 추진하기로 했다. 산업부 관계자는 “미국을 방문하고 있는 김현종 통상교섭본부장이 게리 콘 백악관 국가경제위원회(NEC) 위원장 등과 접촉해 우리 기업 피해를 최소화하는 방안이 채택되도록 강력히 요청하고 있다”고 말했다. 김 본부장은 오는 9일까지 미국에 더 머무를 것으로 보인다. 그러나 미국이 강경 일변도로 무역 정책을 추진하는 상황에서 설득 작전이 얼마나 효과를 얻을 수 있겠느냐는 회의적인 시각도 있다. 미국은 우리나라가 수출하는 철강재의 88%에 이미 반덤핑·상계 관세를 부과한 상태다. 무역확장법 232조에 따른 25% 관세는 현재 관세에 추가로 부과된다. 넥스틸의 경우 현재 유정용 강관에 46.37%의 관세를 붙여 수출하고 있는데 25%가 추가되면 약 70%의 관세를 내야 한다. 넥스틸은 이미 관세부담 탓에 미국 휴스턴에 공장 설립을 추진하고 있다. A철강사 관계자는 “미국은 이미 자국 업체를 보호하기 위해 노골적으로 통상 압력을 가하고 있어 추가로 관세가 부과되면 수출에 영향이 있을 수밖에 없다”고 우려했다. 관세가 이대로 확정되면 대미 수출 의존도가 높은 유정용 강관(천연가스·원유 채취용 강철 파이프)과 송유관을 수출하는 중견업체는 사실상 수출불가 수준의 피해를 입을 전망이다. 포스코는 전체 매출에서 대미 수출 비중이 2∼3%에 그치고, 현대제철과 동국제강도 3∼4% 수준이다. 반면 강관 전문 철강사인 휴스틸과 넥스틸은 매출의 80%를 미국 수출에 의존하고 있다. 중견 철강사인 세아제강도 대미 수출 비중이 20%를 넘는다. 3사의 피해를 합치면 1조원에 이를 전망이다. 업계는 정부가 세계무역기구(WTO) 제소라는 마지막 카드를 꺼내들지 주목하고 있다. 앞서 우리 정부는 미국이 한국을 포함한 12개국에 대해서만 고율 관세를 부과하면 WTO에 제소할 방침을 밝힌 바 있다.박세환 기자그래픽=안지나 기자"
휴스틸,2018.03.03,0300,경제,"“美이익 우선, 예외는 없다”… 동맹국에도 ‘관세 선전포고’","[트럼프, 전세계에 관세폭탄]“모든 수입 철강에 25% 부과” 도널드 트럼프 미국 대통령이 1일 자국으로 수입되는 모든 철강 제품에 일률적으로 관세를 부과한 것은 ‘아메리카 퍼스트(미국 우선주의)’를 분명히 한 상징적인 조치라는 평가다. 미국의 이익과 일자리를 위해서는 동맹국도 예외가 될 수 없다는 경고로 유럽연합(EU)과 캐나다, 일본 등은 허를 찔린 표정이다. 최소 53% 선별 관세 부과 대상으로 거론됐던 한국은 일단 우박은 피한 셈이다. 하지만 트럼프 대통령이 한국을 중국 제품의 대표적 우회 수출로로 보는 점은 앞으로도 각종 통상 현안에서 부담이다. ○ ‘아메리카 퍼스트’ 분명히 지난달 16일(현지 시간) 미 상무부는 철강 및 알루미늄 제품에 대한 ‘무역확장법 232조 보고서’를 공개했다. △모든 국가 철강 제품에 24% 관세(글로벌 관세) △한국 등 12개국에 53% 관세(선별 관세) △국가별 대미(對美) 수출액을 2017년의 63%로 제한(글로벌 쿼터) 등 세 가지 방안 중 선별 관세가 가장 유력한 것으로 평가받아 왔다. 한국 외 다른 동맹국은 자극하지 않으면서 중국산 철강 제품을 견제할 수 있다는 이유에서다.관련기사관련기사 2건 더보기 뚜껑을 열고 보니 트럼프 대통령은 어떤 예외도 인정하지 않았다. 뉴욕타임스에 따르면 트럼프 대통령은 “예외가 있으면 모든 국가가 이 국가를 수출 통로로 삼을 것”이라고 주장했다. 중국이 우회 수출로를 활용할 가능성을 원천 차단해 ‘무역확장법 232조’의 효과를 극대화겠다는 의지를 나타낸 것이다.블룸버그통신은 동맹이라는 이유로 관세를 피해 갈 것으로 예상됐던 미국시장으로의 수출 1위 캐나다와 멕시코(4위)를 최대 피해자로 꼽았다. 트럼프 대통령 취임 초부터 관계 강화에 공을 들여온 일본도 뒤통수를 맞은 표정이다. 물론 트럼프 대통령의 행정명령 서명이 공식적으로 이뤄지기 전 선택이 바뀔 가능성도 있다. 트럼프 대통령은 이날 관세를 면제받는 국가가 있는지에 대해서는 구체적으로 답변하지 않았다. 미국 언론에서는 캐나다 등 주요 우방국이 빠져나갈 가능성을 완전히 배제할 수 없다는 전망이 나오는 이유다.○ 중소·중견 철강업체 피해 커 최악은 피했지만 미국시장 수출 3위 한국도 충격을 피하기는 어렵다. 2일 관세청에 따르면 한국 철강의 미국 시장 비중은 금액 기준으로 12.1%다. 중국(15%), 일본(12.2%)에 이어 세 번째로 많다. 국내 철강업계 중에서도 직격탄을 맞는 곳은 강관(철로 만들어진 파이프)을 주로 생산하는 중견·중소기업들이다. 강관은 전체 수출 물량의 56.1%를 차지하고 있다. 대부분 미국 수출용이다. 미국은 현재 셰일가스 시추 사업, 신재생에너지 사업 등에 쓰이는 강관 수요가 많아 한국 강관업체들에는 가장 중요한 수출국이다. 미국의 이번 조치로 국내 강관업체 중 넥스틸의 유정용 강관은 기존 46% 관세에 25%가 추가로 붙어 총 71%의 관세가 매겨지게 됐다. 세아제강의 유정용 강관은 6.6%에서 31.6%로, 휴스틸도 19%에서 44%로 관세가 오른다. 이 업체들은 이번 관세 때문에 수출 물량이 얼마나 줄어들지 예상할 수 없어 손해액조차 산정하지 못하고 있다. 자동차용 강판 등 고부가가치 비중이 높은 포스코, 현대제철 등 주요 대기업은 이번 파장에서 다소 비켜 가는 분위기다. 포스코 관계자는 “글로벌 연간 판매량이 약 3800만 t 정도 되는데 미국 판매 물량은 100만 t 정도에 불과해 타격은 크지 않다”고 했다. 현대제철도 포스코보다는 미국 의존도가 높지만 시간이 지나면 회복 가능하다는 분위기다.다만 시장에서는 철강업 전체가 침체될 가능성이 제기됐다. 이날 주식시장에서 동국제강(5.12%) 포스코(3.60%) 현대제철(2.99%) 휴스틸(2.54%)의 주가는 큰 폭으로 하락했다.○ 중국 우회 수출로 인식 부담 백운규 장관 주재로 이날 내부 대책회의를 연 산업통상자원부는 미국이 세계 모든 국가를 상대로 관세를 부과하면 세계무역기구(WTO) 제소를 통해 승소할 가능성이 떨어지는 만큼 대응책 마련에 고심하고 있다.무엇보다 미국이 ‘무역확장법 232조 보고서’를 통해 한국을 중국산 제품의 우회 수출로로 낙인찍은 점이 부담이다. 한국은 한미 자유무역협정(FTA) 개정 협상 등 미국과 풀어야 할 통상 문제가 산적해 있다. 미국이 중국에 각종 무역 보복 조치를 단행하면 한국까지 휩쓸릴 가능성이 크다. 안덕근 서울대 국제대학원 교수는 “중국에서 원재료를 들여와 가공 수출하는 구조를 단기간에 바꾸는 건 불가능하다. 미국을 설득할 수 있는 논리를 개발하고 수출 국가를 다각화해야 한다”고 했다.세종=이건혁 gun@donga.com·이은택 기자 / 뉴욕=박용 특파원 "
