회사,날짜,시간,카테고리,제목,본문
휴스틸,2012.07.16,0530,전체,"셰일가스 新골드러시, 금맥 잡는 기업은?"," MTIR sponsor‘제2의 석유’ 또는 '미래 100년간의 에너지원'으로 불리는 셰일(Shale) 가스 개발이 미국, 캐나다 등 북미지역에서 본격화되면서 우리나라 정부와 기업들도 이 '신(新) 골드러시(Gold Rush)'에 동참하기 위한 방안 마련에 분주하다. 셰일가스 개발·공급 본격화에 따른 수혜기업은 어떤 곳들일까?15일 관련 업계에 따르면 정부는 지난 5월 셰일가스 민관합동 태스크포스(TF)를 출범시킨데 이어 다음달 셰일가스 개발 관련 선제적 대응을 위한 종합대책을 마련해 발표할 예정이다. 셰일가스는 진흙 등이 굳어져 만들어진 혈암층에 갇혀있는 가스를 말한다. 통상적인 천연가스보다 깊은 지층에 넓게 분포돼 있어 시추가 어렵다는 점 때문에 그동안 적극적인 개발이 이뤄지지 않았다. 그러나 최근 수직으로 땅을 뚫고 들어간 뒤 지표면과 수평으로 사방을 훑을 수 있는 수평시추 공법이 개발되면서 경제성 있는 채굴이 가능해졌다.미국 행정부는 셰일 가스의 개발과 생산을 통해 2016년 천연가스 순수출국으로 전환하기 위한 방안을 적극 추진 중이다. 미 행정부의 계획에 따르면 미국 LNG 생산량 가운데 셰일 가스가 차지하는 비중은 지난해 30%에서 2035년 약 절반인 49%로 높아질 전망이다. 캐나다도 ‘서부 캐나다 퇴적분지’(WCSB, Western Canada Sedimentary Basin)에 위치한 혼강(Horn River)의 셰일 가스를 한국, 일본 등 동아시아에 수출하는 방안을 추진 중이다.셰일가스 개발이 본격화될 경우 가장 큰 수혜를 볼 수 있는 분야로는 철강, 조선, 플랜트, 기계 등이 꼽힌다. 가스를 개발하고 운송하는데 필요한 에너지 강관(파이프) 업체로는 포스코 (236,500원 2000 -0.8%), 세아제강 (47,400원 0 0.0%), 휴스틸 (9,980원 20 -0.2%) 등이 있다. 하이투자증권에 따르면 미국 송유관 수입시장에서 한국산 제품의 시장점유율은 2008년 11%에서 2011년 27.6%로, 유정용 강관 시장점유율은 9.1%에서 23.3%로 높아졌다. 세아제강과 휴스틸의 경우 이미 강관 매출 가운데 수출비중이 40% 안팎에 달한다. 특히 휴스틸은 지난해 매출액 5612억원의 약 30%를 미국 가스관 수출을 통해 올렸다. 포스코는 셰일가스 개발에 필요한 고급 에너지 강재 판매를 확대하기 위해 대우인터내셔널에 에너지강재본부를 신설했다. 포스코는 전세계 에너지 강재 수요가 현재 6000만톤에서 3년내 8000만톤까지 확대될 것으로 예상하고, 세계 시장 점유율을 10%까지 높이는 것을 목표로 하고 있다. 포스코 관계자는 ""셰일가스 개발에 적합한 강재를 생산하기가 쉽지 않은데, 포스코는 이미 오래 전부터 준비를 시작해 이미 그런 강재 기술을 확보하고 있다""고 말했다.한편 조선 분야의 경우 추가적인 액화천연가스(LNG)선 수요가 예상된다. 세계 최대 천연가스 소비지역인 동아시아를 기준으로 볼 때 셰일가스 주요 생산지인 북미까지의 거리가 기존 최대 공급처였던 중동보다 멀다는 점에서다. 부유식 액화천연가스 저장·재기화 설비(LNG-FSRU)의 수요도 늘어날 수 있다. 이에 따라 세계 최고의 LNG선 및 FSRU 경쟁력을 보유한 현대중공업 (126,500원 0 0.0%), 삼성중공업 (7,270원 80 1.1%), 대우조선해양 (27,850원 50 -0.2%) 등 국내 대형 조선업체 3사의 수혜가 전망된다. 북미 변압기 시장 점유율 1위 현대중공업의 경우 북미 셰일가스 발전소 건설에 따른 효과도 기대된다. 이윤상 NH투자증권 애널리스트는 “북미의 LNG 수출이 본격화되면 LNG선은 연평균  30여척씩 지속적으로 신규 발주될 것”이라며 “FSRU 시장도 다시 본격적으로 성장할 수 있다”고 밝혔다.기계 분야에서는 셰일가스 개발 설비에 필요한 가스 압축기를 생산하는 삼성테크윈 (35,050원 150 0.4%), 산업용 감속기를 제조하는 우림기계 (3,165원 5 -0.2%), 굴삭기 전문업체 두산인프라코어 (5,550원 80 1.5%) 등이 수혜 대상으로 지목된다.향후 우리나라로 저가의 셰일가스 도입이 시작될 경우 LNG 가격이 낮아지는 효과가 기대된다. 한국가스공사는 최근 미국 에너지 사업자 '시니어 에너지'(Cheniere Energy)와 루이지애나주 소재 '세이바인 패스(Sabine Pass) LNG 기지'로부터 2017년 이후 20년간 연 350만톤의 LNG를 수입하는 내용의 계약을 체결했다. 이는 지난해 우리나라의 LNG 도입량 3397만톤의 10%를 넘어서는 규모다.이 미국산 LNG의 도입 가격은 현재 우리나라의 최대 LNG 수입원인 카타르산 LNG를 비롯한 기존 수입 LNG의 약 절반 수준에 머물 것으로 예상된다. IEA는 미국의 LNG 수출이 본격화되는 2016년 이후 아시아 지역의 LNG 가격이 1mmBtu(약 25만㎉ 열량을 내는 가스량)당 11달러 수준에서 안정될 것으로 예상했다. 이는 현재(최고 18.6달러)에 비해 최대 40% 낮은 가격이다.이에 따라 셰일가스 도입시 도시가스 요금 인하와 발전 비용 하락 등을 기대할 수 있다. 압축천연가스(CNG) 버스의 연료비 절감 등도 예상된다.한편, 국내 기업들은 시추에 직접 참여하지 못하고, LG상사와 대우인터내셔널 정도가 미국 등이 주도하는 셰일가스 개발 프로젝트에 지분을 투자할지 고민하는 수준이다. 미국과 캐나다만이 시추방법에 대한 독점 기술을 갖고 있기 때문이다.                            "
휴스틸,2012.06.07,1514,전체,"철강업계, 해양전문위 설립...해양 플랜트 공동 공략"," MTIR sponsor철강업계가 고부가 산업인 해양플랜트에 대한 마케팅 대응력을 높이기 위해 머리를 맞댄다. 6일 관련업계에 따르면 올해 안으로 한국철강협회 내에 '해양전문위원회(가제)'가 설립된다. 이 위원회는 해양플랜트 등 유전개발에 사용되는 에너지용 강관(파이프)제조업체로 구성될 예정이다. 시너지(협력 효과)를 높이기 위해 포스코 (236,500원 2000 -0.8%)와 현대제철 (31,450원 50 -0.2%) 등 철강 소재 공급업체의 참여도 추진 중이다. 철강업계 관계자는 위원회 설립 취지에 대해 ""고유가로 유전개발이 증가하면서 해양플랜트 산업이 호황을 누리고 있다""며 ""철강업계가 마케팅 대응력을 높이고 공통적으로 영위할 수 있는 사업을 발굴하기 위한 것""이라고 설명했다.국내 대표강관업체인 세아제강을 비롯해 에너지용 강관을 생산하는 6~7개사가 현재 참여를 거의 확정지은 것으로 전해졌다. 강관업체 뿐 아니라 포스코, 현대제철 등 철강소재업체도 참여를 검토하고 있다. 강관업체들은 포스코, 현대제철 등 소재업체로부터 후판(두께 6mm 이상의 판재류), API 강재(미국석유협회 인증 강재), 스테인리스 등 특수강종을 공급받아 강관을 생산한다. 따라서 강재공동개발 등 소재업체와의 협력은 필수적이다. 보통 협회 내 구성되는 위원회는 업종별로 묶이는 것이 일반적이지만 이번 위원회는 산업별 시너지를 고려해 강관업체와 소재업체가 함께 구성될 필요가 있다는 게 업계의 시각이다. 철강협회는 강관사와 소재업체를 포함, 총 10곳 정도가 새 위원회에 참여할 것으로 예상하고 있다. 올해 구성안 마련을 완료하고 내년부터 본격적인 활동을 전개할 방침이다. 에너지용 강관은 석유 및 천연가스의 시추와 생산, 수송, 저장 및 처리 등에 사용되는 철강제품을 뜻한다. 석유 및 가스 시추용으로 사용되는 제품은 강관 제품이 주로 사용된다. 수송 및 저장 용도로는 API 강관, 압력용기용 강재 등이 사용된다. 최근 유가상승 및 육상유전 고갈에 따라 개발유전이 심해, 극지 등 가혹한 환경으로 이동하고 셰일가스, 오일샌드 등 비전통 유전으로 개발이 확대됨에 따라 요구되는 강재품질도 더욱 엄격해지고 있다.이에 따라 세아제강 (47,400원 0 0.0%), 현대하이스코 (57,600원 1700 -2.9%), 휴스틸 (9,980원 20 -0.2%) 등 국내 강관업체들은 지난해 관련 부문의 매출액이 적게는 10%에서 많게는 50% 늘었다. 지난해 국내 강관수출량도 전년보다 30% 정도 상승했다. 그러나 몇몇 업체를 빼고는 대부분 중소기업인 국내 강관사들은 해외 오일메이저나 유전개발 시공사 등에 대응하기 위한 마케팅 역량 강화에 대한 필요를 느껴왔다. 철강협회 관계자는 ""위원회의 우선적인 타깃은 마케팅 쪽""이라며 ""미국 휴스턴에서 개최되는 세계 최대 해양박람회인 OTC전시회도 같이 꾸려나가고 홍보책자, 영상물 등을 공동으로 만드는 활동을 생각하고 있다""고 말했다.이 관계자는 ""또 회원사들의 공통적인 컨센서스(공감대)가 이뤄지는 부분이 있으면 그 쪽으로 위원회의 활동이 확대될 것""이라고 덧붙였다. 한편 해양전문위원회가 발족하는 하반기에는 위원회를 대표할 회장 선출도 함께 이뤄진다. 회장은 위원회를 주도적으로 이끄는 회원사의 대표가 맡는 경우가 일반적이다.                            "
휴스틸,2012.03.30 ,"1804
","

증권/금융

",코스닥 224개사 30일 동시 주총，소액주주 목소리는 여전히 묻혀,"코스닥 상장사 224개사가 동시에 정기주주총회를 가진 30일, 일부 상장사 주총에선 작은 충돌이 있었지만 무난히 처리됐다.대우조선해양, 한국전력공사, 두산중공업 등 84개 코스피 상장사의 주총이 처리된 가운데 주총시즌도 사실상 마무리됐다.그러나 이번 주총에서도 소액주주의 목소리는 여전히 외면되는 등 예전 관행에서 크게 벗어나지 못했다는 지적이 일고 있다.■신속·무난한 처리코스닥 상장사 가운데 포스코엠텍은 10분의 1 주식 액면분할과 윤용철 대표 재선임안을 통과시켰고 메디포스트는 임기 만료된 양윤선 대표이사 사장과 황동진 사장, 오원일 부사장 재선임 안건을 처리했다.감사의견이 거절된 동양텔레콤은 이용인 사외이사 선임 안건과 이사보수한도, 이사회 자사주 소각 범위 확대 등의 정관 변경안 등을 처리했다.관리종목으로 지정됐던 제넥신은 이날 주총을 갖고 성영철 대표이사 재선임안과 이병권 부사장 신규선임, 이사보수한도 안건을 승인했다.다음커뮤니케이션은 이사의 책임을 낮추는 등의 안건을 철회한 채 정관을 변경하는 안건을 처리하면서 무난히 주총을 마쳤다. 코스피 상장사의 경우, 오리온은 담철곤 회장 대표이사 연임안을 통과시켰다.한솔제지는 '이사회 의장을 사외이사 중에서 선임키로 한다'는 내용의 주주제안을 부결시켰고 이사보수 한도액을 20억원이 늘어난 90억원으로 승인했다.CJ도 손경식 대표이사 회장을 재선임했고 쌍용건설은 김형준 전 청와대 춘추관장에 대한 감사 선임과 신규발행 규모 한도 폐지, 신주발행 대상에 외국인 투자자 포함 안건을 처리했다.대표이사 선임과 관련, 논란을 빚었던 대우조선해양은 이날 주총을 통해 고재호 사장을 신임 대표이사로 선임한 데 이어 정관 일부 변경건 등 총 5건의 안건을 처리했다.우리금융지주는 소액주주들의 항의가 있었지만 전년과 동일한 주당 250원의 배당을 실시키로 했다.특히 한국전력공사의 주총에선 4년 연속 배당이 이뤄지지 않은 등 부진한 실적에 대한 주주들의 성토가 이어졌지만 안건들은 무사히 처리됐다.전기요금 인사 계획 등에 대한 주주들의 질문에 김중겸 한전 사장은 ""중요한 경영사항이라 밝히기가 곤란하다""며 ""전력원가에 못 미치는 전기요금 수준으로 인해 흑자로 전환되지 못하고 있다""고 해명했다.■이번 주총도 이변 드물어1690여개 상장사들이 주총을 마친 가운데 이번 주총도 소액주주들의 말발은 제대로 먹히지 못했다.배당금 확대와 사외이사 선임을 요구하며 도전장을 내밀었던 소액주주들은 남양유업과 삼천리, 대한방직, 휴스틸 등 주총에서 자신들이 원하는 안건을 단 하나도 통과시키지 못했다.힘이 될 수 있었던 국민연금 등 기관투자가들은 거수기에 그치며 비판의 대상에 오르기도 했다. 아울러 막바지에 코스닥 상장사들의 주총이 몰리는 관행도 여전했고 주주들의 관심을 분산시키고자 금요일에 쏠린 주총일정은 눈살을 찌푸리게 했다.지난 23일 금요일에 SK, 한화, 롯데쇼핑, KB금융, 하나금융지주 등 주요 상장사 672개사가 동시에 주총을 개최해 단일 주총 개최로는 역대 최대 규모를 기록한 바 있다.한 소액투자자는 ""상장사들이 전자투표제를 도입하도록 의무화해야 소액주주들의 의견이 그나마 반영될 수 있을 것""이라고 지적했다.padet80@fnnews.com 박신영 강재웅 김학재기자"
휴스틸,2012.03.25,1751,전체,[기자의 눈] 소액주주의 한숨,"		 ""소액주주의 제안이 회사 측에 받아들여지기 어려울 것이라 생각했습니다. 하지만 이렇게라도 해서 주주들의 의견을 사측에 전달해야 했습니다."" 남양유업의 주주총회에서 주주 제안에 찬성표를 던진 한 소액주주의 한숨 섞인 말이다. 남양유업 주총은 라자드코리아자산운용이 운용하는 '한국기업지배구조펀드(일명 장하성펀드)'가 주주총회에서 현금배당 확대 등을 요구하며 사측과 표 대결을 벌여 관심을 모았던 곳. 일부 자산운용사와 소액주주들이 여기에 찬성표를 던지기는 했지만 결과는 역시 사측의 압승으로 나타났다.올해 주총의 화두 중 하나는 '소액주주들의 반란'이었다. 삼천리ㆍ휴스틸ㆍ대한방직 등의 주총에서는 소액주주 측이 배당금 확대와 사외이사 선임 등을 요구하며 사측과 날을 세웠다. 특히 일부 대기업 경영진들의 횡령ㆍ배임 혐의발생으로 경영투명성 문제도 논란거리로 떠올랐다. 하지만 막상 뚜껑을 열었더니 이변은 없었고 일사천리 무사통과였다.소액주주 운동이 최근 부쩍 활발해졌다고는 하지만 아직 힘에 부치는 게 사실이다. 이번에 남양유업이나 삼천리 등 관심이 집중된 곳도 소액주주들이 일부 기관ㆍ외국인 투자가와 손을 잡으면서 그나마 힘이 실렸기 때문이다. 포스코가 소액주주의 반대로 이사의 책임한도를 낮추려던 계획을 포기했지만 그 이면에는 국민연금의 의사가 더 크게 작용했을 것이라는 평가다.캐스팅보트는 기관들이 쥐고 있지만 올 주주총회에서도 기관투자가들은 대부분 무관심 속에 여전히 거수기에 그치고 있다.이런 상황에서 기댈 곳 없는 최근 소액주주들의 움직임은 움직이지 않는 벽일지언정 소리라도 질러야 한다는 하소연인 셈이다.주주총회 현장에서 만난 소액주주들의 불만은 결국 '소통의 부재'로 모아졌다. 사측이 평소 주주들의 의견에는 관심 없고, 회사의 중요 결정사항에 대한 설명도 부족하다는 것이다. 올해 주주총회에서 소액주주들이 손에 쥔 것은 많지 않다. 그러나 많은 경영진들이 '주주와의 소통'과 '주주가치 제고'를 약속했다. 앞으로는 벽에다 한 투자자들의 하소연이 진정성 있는 '소통'이라는 메아리로 돌아오기를 기대한다.증권부=김종성기자 stare@sed.co.kr[한국아이닷컴 인기기사]☞""30대 이상 여성 조심하라"" 공포의 질병☞갑자기 분주한 움직임이… 北 또 수상하다☞서울 아파트값 무섭게 떨어진다☞이 정도까지… 北 '참담한 실상' 충격☞'늙은이는 가라' 호텔 피트니스 물 관리[ⓒ 인터넷한국일보(www.hankooki.com), 무단 전재 및 재배포 금지]"
휴스틸,2012.03.23,1847,전체,'하이퍼 주총데이'..이변은 없었다(종합)," MTIR sponsor""하이퍼주총데이, 이변은 없었다.""이번 주총시즌 들어 가장 많은 672개 상장사들이 23일 일제히 주총을 개최한 가운데 삼천리 (84,500원 100 -0.1%), 대한방직 (20,150원 100 0.5%) 등 경영진과 소액주주들의 대결로 관심을 모았던 주총에서 경영진들이 일방적 승리를 거뒀다. 이날 서울 여의도에서 열린 삼천리 주총에선 배당액, 사외이사 선임건을 놓고 경영진과 소액주주들이 표대결에 나섰지만, 경영진측이 압도적인 표 차이로 승리했다. 경영진이 제안한 3000원과 소액주주들이 주장한 1만원 배당금 표결에서는 참석자중 81%인 187만여주가 경영진의 손을 들어줬다. 또 사외이사도 이사회가 추천한 손양훈 지식경제부 전기위원회 위원, 조성봉 숭실대 경제학과 교수, 김병일 김앤장 상임고문이 84%대 지지를 얻어 선임됐다. 대한방직도 이날 주총에서 주주제안 감사선임안을 제외한 4건의 의안을 모두 승인했다. 대한방직 지분 2.97%를 보유한 소액주주가 신영철 전북대 교수의 감사 선임안을 제안했지만, 부결됐다. 소액주주들이 유상감자, 자사주 매입 등을 제안한 휴스틸 (9,980원 20 -0.2%)의 주주총회는 한 시간여 만에 현 경영진 측의 일방적인 승리로 끝났다. 충남 당진 공장 대강당에서 열린 정기 주총에서 소액주주들은 회사 측에 현금 배당 확대, 중간배당 실시, 유상감자, 자사주 매입 등을 주주제안으로 제시했다. 그러나 소액 주주들이 제안한 안건이 모두 부결되면서 주총은 한시간만에 종료됐다. 대주주간 진압 싸움이 벌어지고 있는 동남합성 (24,850원 500 -2.0%) 주총에선 경영참여를 목적으로 동남합성 지분을 확보한 미원상사측 인사 2명이 이사로 선임됐다. 동남합성 참업주 이의갑씨의 차녀인 이주희씨와 큰딸인 이지희 대표는 지난해부터 경영권 분쟁을 벌이고 있다. 현재 동남합성 대주주의 의결권은 자사주를 제외하면 약 33%이고, 미원상사그룹의 의결권은 약 26%다. 김정돈(58) 미원상사 대표이사는 이날 주총 후 ""이지희 동남합성 부회장의 경영을 지지하며 이 부회장의 현재 지분율이 낮아 경영권 안정화에 도움을 주기 위해 지분을 인수한 것""이라고 밝혔다. 사실상 이 부회장의 백기사 역할을 주장하고 나선 것이다. 김승연 한화그룹 회장의 사내이사 선임안건이 부의된 한화케미칼 (18,850원 0 0.0%) 주총에서는 김회장 등 이사 6명에 대한 선임의 건을 비롯해 안건들이 모두 원안대로 처리됐다. 한화케미칼의 지분 2.4%를 가지고 있는 국민연금은 지난 21일 지배주주의 명백한 주주가치 훼손 행위가 있는 기업의 이사나 감사에 대해서는 감시·감독 의무를 제대로 수행하지 못한 책임을 물어 연임에 반대하기로 한 원칙에 따라 반대표결 했지만 별다른 변수가 되지 못했다. 김 회장은 횡령·배임 혐의 등으로 기소돼 지난 22일 1심 공판이 열렸다.                            "
휴스틸,2012.03.23,1710,경제,미원상사 `자매분쟁 동남합성` 경영참여 이변," 223일 열린 동남합성 주주총회에서 자매 간 경영권 다툼으로 대주주 표가 나뉘면서 외부 주주인 미원상사그룹이 추천한 이사가 경영진에 선임되는 이변이 일어났다. 증시에서는 미원상사그룹의 동남합성 적대적 인수ㆍ합병(M&A)설이 심심치 않게 제기돼 왔던 터라 향후 경영권을 놓고 분쟁이 예고되는 대목이다.인천 부평구 동남합성 본사에서 열린 주총은 30분간의 정회를 포함해 3시간이나 걸리는 진통 끝에 마무리됐다. 회사 측이 제안한 재무제표 승인 등의 안건이 처리된 반면 이사ㆍ감사 선임을 놓고 회사 측과 미원상사그룹 측의 치열한 표대결이 벌어졌다. 미원상사그룹은 경영권 참여를 목적으로 자회사인 미원화학과 태광정밀화학 등을 통해 동남합성 지분 26.45%를 보유하고 있다. 현 경영진 측은 특수관계인을 포함해 33.07%의 지분을 갖고 있다. 자사주 20.4%를 포함할 경우 미원상사 측의 안건을 부결시키기에 충분한 지분이다. 문제는 지난해 창업주인 이의갑 씨와 차녀 이주희 씨가 임시주주총회를 열고 현 대표이사이자 장녀인 이지희 씨와 경영권을 놓고 분쟁을 벌였다는 점이다. 이날 주총에서 이의갑 씨와 이주희 씨 등이 보유한 지분 27.44%는 현 경영진이 아닌 미원상사 측과 손을 잡았다. 외부세력 지분율이 53.89%까지 높아진 반면 경영진 지분은 26.03%로 뚝 떨어지게 된 것이다. 과반수 지분을 확보하게 된 미원상사그룹은 당초 사내이사 2명, 사외이사 1명, 감사 1명을 추천했으나 사측과 협의 끝에 사내이사 1명, 사외이사 1명을 이사회에 포함시키는 선에서 마무리를 했다. 이에 따라 미원상사그룹 측 인사인 양종상 미원상사 전무가 동남합성의 사내이사로, 강연승 IP-POST 특허법률 대표변리사가 사외이사로 포함됐다. 동남합성의 한 소액주주는 ""미원상사그룹이 경영에 참여할 경우 회사 가치 증진에 도움이 된다는 의견이 많았다""며 ""지난해 대주주 간에 벌어진 경영권 분쟁도 집안 싸움으로 비쳐져 좋지 않은 인식을 주주들에게 줬다""고 설명했다.다른 상장사들의 주총에서는 소액주주들이 제안한 안건의 통과 여부가 관심을 모았지만 `찻잔 속 태풍`에 그쳤다. 삼천리 주총에서는 유상증자와 주식 소각, 고배당 등 9건의 안건을 제안했지만 모두 부결됐다. 유상감자와 주식 소각은 찬성률이 18.9%에 그쳤고, 1만원을 제시했던 주당 현금배당도 80.98%의 주주가 선택한 회사 측 안인 3000원으로 정해졌다. 이날 여의도 사학연금회관에서 열린 대한방직 주총에서도 주주 제안으로 상정된 대한방직의 감사 선임 안건도 부결됐다. 휴스틸 주총에서도 소액주주들이 제시한 중간배당과 69만1861주의 유상감자, 15만주의 자기주식 매입 안건이 표결을 거쳤으나 결국에는 통과되지 못했다. 소액주주들이 안건을 통과시키는 데 실패했지만 20% 이상의 지지표를 얻어내 의미 있는 시도였다는 평가가 나오고 있다. 김택환 휴스틸소액주주연대 카페지기는 ""외국인들도 우리 쪽에 표를 던져 예상보다 많은 표를 얻었다""면서 ""앞으로도 계속 소액주주 운동을 벌여 나갈 것""이라고 말했다. [노현 기자 / 이덕주 기자 / 인천 = 이유섭 기자][ⓒ 매일경제 & mk.co.kr, 무단전재 및 재배포 금지]        					"
